{
  "$schema": "https://json-schema.org/draft/2020-12/schema",
  "title": "Earn proposal (spec section 7, schema_version 4)",
  "type": "object",
  "additionalProperties": false,
  "required": [
    "run_id",
    "prompt_version",
    "module",
    "targets",
    "exposure_scale",
    "confidence",
    "abstain",
    "horizon_days",
    "rationale",
    "invalidation"
  ],
  "properties": {
    "schema_version": {
      "type": "integer",
      "minimum": 2,
      "maximum": 4
    },
    "run_id": {
      "type": "string",
      "pattern": "^\\d{4}-\\d{2}-\\d{2}T\\d{2}:\\d{2}[+-]\\d{2}:\\d{2}$"
    },
    "prompt_version": {
      "type": "string",
      "pattern": "^research\\.v\\d+$"
    },
    "module": {
      "enum": [
        "trend",
        "dca",
        "cash",
        "hold"
      ]
    },
    "targets": {
      "description": "Sparse target weights. An asset you do not name is zero. USDT is always required. Every other key must be in the tradeable tier of the universe snapshot you were given (today: BTC, ETH, USDT); a key outside it rejects the whole proposal.",
      "type": "object",
      "propertyNames": {
        "pattern": "^[A-Z0-9]{2,12}$"
      },
      "additionalProperties": {
        "type": "number",
        "minimum": 0,
        "maximum": 1
      },
      "required": [
        "USDT"
      ],
      "minProperties": 1,
      "maxProperties": 9
    },
    "exposure_scale": {
      "type": "number",
      "minimum": 0,
      "maximum": 1
    },
    "confidence": {
      "type": "number",
      "minimum": 0,
      "maximum": 1
    },
    "abstain": {
      "type": "boolean"
    },
    "horizon_days": {
      "type": "integer",
      "minimum": 1,
      "maximum": 30
    },
    "rationale": {
      "type": "array",
      "minItems": 1,
      "maxItems": 6,
      "items": {
        "type": "string",
        "maxLength": 200
      }
    },
    "invalidation": {
      "type": "string",
      "minLength": 10,
      "maxLength": 300
    },
    "signal_id": {
      "type": [
        "string",
        "null"
      ],
      "maxLength": 120
    },
    "universe_snapshot": {
      "description": "The universe snapshot these targets were chosen against. Copy it verbatim from the UNIVERSE block.",
      "type": [
        "object",
        "null"
      ],
      "additionalProperties": false,
      "required": [
        "date",
        "sha256"
      ],
      "properties": {
        "date": {
          "type": "string",
          "pattern": "^\\d{4}-\\d{2}-\\d{2}$"
        },
        "sha256": {
          "type": "string",
          "pattern": "^[0-9a-f]{64}$"
        }
      }
    },
    "plan": {
      "type": [
        "object",
        "null"
      ],
      "additionalProperties": false,
      "properties": {
        "entry_style": {
          "enum": [
            "passive",
            "cross"
          ]
        },
        "stop_pct": {
          "type": [
            "number",
            "null"
          ],
          "exclusiveMinimum": 0,
          "maximum": 1
        },
        "take_profit_pct": {
          "type": [
            "number",
            "null"
          ],
          "exclusiveMinimum": 0,
          "maximum": 1
        },
        "dca_allowed": {
          "type": "boolean"
        },
        "valid_for_hours": {
          "type": [
            "integer",
            "null"
          ],
          "minimum": 1,
          "maximum": 720
        }
      }
    }
  }
}
